{
  "urn": "urn:lex:br:federal:decreto.lei:1940-12-07;2848",
  "nome": "Código Penal",
  "ementa": "Institui o Código Penal.",
  "dataPublicacao": "1940-12-31",
  "fonte": "planalto",
  "urlFonte": "https://www.planalto.gov.br/ccivil_03/decreto-lei/del2848compilado.htm",
  "capturadoEm": "2026-09-15"
}
